data.name,data.selftext,data.subreddit,data.url,data.thumbnail
t3_17y52oe,,elden ring,https://v.redd.it/6nvgb6xjj31c1,https://a.thumbs.redditmedia.com/aCz_GFmdail2puYmquGGvuqr9eq8gd0xD_QgDvHUts4.jpg
t3_17y51uw,"Meet Haul - the newest addition to Gekko's crew of creatures! During a round, you can deploy her to find and retrieve the highest-value dropped weapon on the map. Careful though, she's got an eye for sparklies - so she'll prioritize skins over weapon quality!

 

",genshin impact,https://www.reddit.com/r/VALORANT/comments/17y51uw/a_gift/,https://a.thumbs.redditmedia.com/PSwo-fMA0FMFhdpTeXfWGLAoz8zqDmqZuISzPlZSde4.jpg
t3_17y4ss3,,left 4 dead,https://youtu.be/1xRtPi378Vw,https://b.thumbs.redditmedia.com/Tk75DsSuyeag2phGuBmAeUkSTCYOpnCSG68qzO_dzkQ.jpg
t3_17y4sqf,"What I mean is, when you press inspect and reload buttons quickly.

In CS:GO you can make knives like the karambit spin around your finger, and I'm wondering if the new dual wield knives do this.

Every YouTuber I've seen just pulls out the knife and inspects. Does anyone have footage to show if you can spin the knife?",minecraft,https://www.reddit.com/r/VALORANT/comments/17y4sqf/does_anyone_have_footage_of_the_new_sentinel_of/,self
t3_17y4evy,"How do I not MVP this? This is absurd, she was trolling all game. Just because she has more first bloods?!?! ONLY 5 MORE?!?!?

",farlight,https://www.reddit.com/r/VALORANT/comments/17y4evy/come_on_now/,https://b.thumbs.redditmedia.com/BajY7Omuys6XY1vTzfWSKg7B4JrELqPrSG8-JEjw50E.jpg
t3_17y46lv,"When you ult, or gte ulted against an opp. just jump and wait for peek, then whiele they reload, spraying and u will totaly gett he kill!",valorant,https://www.reddit.com/r/VALORANT/comments/17y46lv/how_to_beat_an_op_in_iso_ult_100/,self
t3_17y42jy,"Since iso is still new, we don't know much about him. But in his trailer he come out of the shadow, but part of him is still in da shadow, and Omen know the hourglass symbol, iso talks about Omen taking contracts, iso knows so much about omen, What do you think?
",call of duty,https://www.reddit.com/r/VALORANT/comments/17y42jy/valorant_lore_discussion_do_you_think_iso_is_a/,self
t3_17y3xzw,"i cannot find any streamers that live stream custom games. even if they did they are probably not in my region. do you guys have any streamers that stream custom games with chat? (my region is turkey, emea btw)",call of duty,https://www.reddit.com/r/VALORANT/comments/17y3xzw/where_can_i_join_streamers_custom_games/,self
t3_17y3xfq,"I think iso pretty good, like if you can aim he is rly good, just ulti somebody and moving while the crouch spray and 1 tapping them is satisfying, getting the orbs r pretty good. I think agent 8 was a part of kingdom, maybe even a part of omen. I think dive agents r a big problem.  *think SOL 2.0 looks pretty cheap,*",call of duty,https://www.reddit.com/r/VALORANT/comments/17y3xfq/what_are_your_thoughts_on_iso_who_do_yo_think_is/,self
t3_17xz6zd,"I understand that it is a competitive game and everyone is playing on low settings and dont give a shit about textures and models quality, but Im a bit older folk and actually kind of care about these things, I want a game to look pleasant and play on max, and looking at the skin which I potentially want to equip - I expect it to look sick, at least better than original stock.... And the quality of a battlepass skins are a complete nonsense dogshit imo !
",call of duty,https://www.reddit.com/r/VALORANT/comments/17xz6zd/i_never_ever_complain_but_the_skin_quality_is/,https://a.thumbs.redditmedia.com/RrJOQ_yHPPwJqce-ofrYWnvMdePTbS1yBtl2Jmvclm4.jpg
t3_17y3l9x,"i'm convinced that no amount of punishment or ban can make the people who don't care about their account rank to not play competitive and ruin other players rank, if they were given a safe place where ranks don't matter and can troll like they want and leave whenever they want it would keep them away from ranked mode and be a win win for everyone. why even risk getting deranked, reported, and banned for afk in competitive when you have a game mode where you don't get any of those punishment.",call of duty,https://www.reddit.com/r/VALORANT/comments/17y3l9x/the_only_way_to_get_rid_of_trolls_and_afks_in/,self
t3_17y3leh,"In my opinion, Riot is pushing too many agents way too fast and then the agents end up being so… C-tier. Like deadlock still feels underpowered. Yeah the characters are unique in their abilities but they are also just meh. And honestly, I don’t see much use for ISO but that might be because I haven’t played the game all that much this act. Should they be slowing it down and focusing on making balanced characters that fit well in the meta?",call of duty,https://www.reddit.com/r/VALORANT/comments/17y3leh/is_riot_pushing_out_too_many_agents_too_fast/,self
t3_17y2rqn,,call of duty,https://v.redd.it/e3i5wnp6r21c1,"https://external-preview.redd.it/NjdhZXd6MjZyMjFjMT_eCNiz99tWDZj9fpfVegrEKpSwgb1mAK8jFAQt4q9p.png?width=140&amp;height=78&amp;crop=140:78,smart&amp;format=jpg&amp;v=enabled&amp;lthumb=true&amp;s=133e2f354225a2fd5e7ca4dfe63286fdfe7ca545"
t3_17y2oiq,I've been hearing a lot that common angles suck and you should pretty much either hold an off angle or strafe while holding. Are there any disadvantages to holding off angles if so? And when should you ever hold a common angle at all?,call of duty,https://www.reddit.com/r/VALORANT/comments/17y2oiq/is_holding_common_angles_that_bad_when_should_you/,self
t3_17y1nu0,"Is it just me or Valorant has been just not fun recently. The thing that really bothers me is that in all my games there always has to be one person whining. I've been taking a lot of breaks from this game but everytime I come back its just always the same. Like these kids just have the biggest ego nowadays and start to complain 2 rounds into the game??? Like i swear it wasnt this bad a year ago and im still in the same rank.

I am in Immortal 1-3 lobbies on NA servers",call of duty,https://www.reddit.com/r/VALORANT/comments/17y1nu0/valorant_ranked_experience/,self
